{
  "schemaVersion": "compiled-demo-v1",
  "source": {
    "schemaVersion": "demo-v1",
    "path": "demo.yaml",
    "sha256": "aaaaaaaaaaaaaaaaaaaaaaaaaaaaaaaaaaaaaaaaaaaaaaaaaaaaaaaaaaaaaaaa"
  },
  "project": {
    "id": "minimal-dashboard",
    "title": "Minimal Dashboard Reveal"
  },
  "canvas": {
    "width": 1920,
    "height": 1080,
    "fps": 30,
    "durationFrames": 180,
    "durationSeconds": 6
  },
  "brand": {
    "background": "#F4F6F8",
    "foreground": "#121417",
    "accent": "#1F6FEB",
    "fontFamily": "Inter, Arial, sans-serif"
  },
  "assets": [
    {
      "id": "dashboard",
      "type": "image",
      "path": "assets/dashboard.svg",
      "sha256": "bbbbbbbbbbbbbbbbbbbbbbbbbbbbbbbbbbbbbbbbbbbbbbbbbbbbbbbbbbbbbbbb",
      "bytes": 1024,
      "width": 1440,
      "height": 900,
      "alt": "Abstract dashboard fixture",
      "license": "MIT"
    }
  ],
  "scenes": [
    {
      "id": "dashboard-reveal",
      "kind": "screen",
      "startFrame": 0,
      "endFrame": 180,
      "durationFrames": 180,
      "assetId": "dashboard",
      "fit": "contain",
      "from": {"scale": 0.96, "opacity": 0},
      "to": {"scale": 1, "opacity": 1},
      "easing": "ease-out",
      "transitionIn": "fade"
    }
  ],
  "audio": [],
  "outputs": [
    {
      "id": "landscape",
      "width": 1920,
      "height": 1080,
      "fps": 30,
      "fileName": "minimal-dashboard.mp4"
    }
  ],
  "hiapiRequests": []
}
